<?xml version="1.0" encoding="utf-8"?>

<!--

  Copyright 2012-2013 Mohawk College of Applied Arts and Technology
  
  Licensed under the Apache License, Version 2.0 (the "License"); you 
  may not use this file except in compliance with the License. You may 
  obtain a copy of the License at 
  
  http://www.apache.org/licenses/LICENSE-2.0 
  
  Unless required by applicable law or agreed to in writing, software
  distributed under the License is distributed on an "AS IS" BASIS, WITHOUT
  WARRANTIES OR CONDITIONS OF ANY KIND, either express or implied. See the 
  License for the specific language governing permissions and limitations under 
  the License.
  
  User: fyfej
  Date: 21-8-2012


-->

<xs:schema attributeFormDefault="unqualified" elementFormDefault="qualified" xmlns:xs="http://www.w3.org/2001/XMLSchema">
  <xs:simpleType name="attributeName">
    <xs:restriction base="xs:string">
      <xs:enumeration value="x509.cert"/>
      <xs:enumeration value="x509.store"/>
      <xs:enumeration value="x509.location"/>
      <xs:enumeration value="client.cert"/>
      <xs:enumeration value="client.store"/>
      <xs:enumeration value="client.location"/>

    </xs:restriction>
  </xs:simpleType>
  <xs:element name="marc.hi.ehrs.cr.messaging.hl7">
    <xs:complexType>
      <xs:sequence>
        <xs:element name="services">
          <xs:complexType>
            <xs:sequence>
              <xs:element name="service" minOccurs="1" maxOccurs="unbounded">
                <xs:complexType>
                  <xs:sequence>
                    <xs:element minOccurs="0" maxOccurs="unbounded" name="attribute">
                      <xs:complexType>
                        <xs:attribute name="name" type="attributeName" use="required"/>
                        <xs:attribute name="value" type="xs:string"/>
                      </xs:complexType>
                    </xs:element>
                    <xs:element minOccurs="1" maxOccurs="unbounded" name="handler">
                      <xs:complexType>
                        <xs:sequence>
                          <xs:element name="message" maxOccurs="unbounded">
                            <xs:complexType>
                              <xs:attribute name="name" type="xs:string" use="required" />
                              <xs:attribute name="isQuery" type="xs:boolean"/>
                            </xs:complexType>
                          </xs:element>
                        </xs:sequence>
                        <xs:attribute name="type" type="xs:string" use="required" />
                      </xs:complexType>
                    </xs:element>
                  </xs:sequence>
                  <xs:attribute name="name" type="xs:string" use="required" />
                  <xs:attribute name="address" type="xs:string" use="required" />
                  <xs:attribute name="timeout" type="xs:time"/>
                </xs:complexType>
              </xs:element>
            </xs:sequence>
          </xs:complexType>
        </xs:element>
      </xs:sequence>
    </xs:complexType>
  </xs:element>
</xs:schema>