<marc.hi.ehrs.cr.messaging.hl7 xmlns:xsi="http://www.w3.org/2001/XMLSchema-instance" xsi:noNamespaceSchemaLocation="file://./Configuration/marc.hi.ehrs.cr.messaging.hl7.xsd">
  <services>
    <!--<service name="TCP Listener" address="tcp://0.0.0.0:1027">
        <handler type="MARC.HI.EHRS.CR.Messaging.PixPdqv2.PixHandler, MARC.HI.EHRS.CR.Messaging.PixPdqv2, Version=1.0.0.0">
          <message name="QBP^Q23"/>
        </handler>
        <handler type="MARC.HI.EHRS.CR.Messaging.PixPdqv2.PdqHandler, MARC.HI.EHRS.CR.Messaging.PixPdqv2, Version=1.0.0.0">
          <message name="QBP^Q22"/>
        </handler>
        <handler type="MARC.HI.EHRS.CR.Messaging.PixPdqv2.NotSupportedHandler, MARC.HI.EHRS.CR.Messaging.PixPdqv2, Version=1.0.0.0">
          <message name="*"/>
        </handler>
      </service>-->
    <!--<service name="SLLP Listener" timeout="00:00:30" address="sllp://0.0.0.0:2200">
        <attribute name="x509.cert" value="555A48A9DED421A8E1CF40CEDADD6732782850DF"/>
        <attribute name="x509.store" value="My"/>
--><!--        <attribute name="client.castore" value="Root"/>
        <attribute name="client.cacert" value="8fde87cfea569e65a3c44ea2dcc1af3ca5bd12c1"/>--><!--
        <handler type="MARC.HI.EHRS.CR.Messaging.PixPdqv2.PixHandler, MARC.HI.EHRS.CR.Messaging.PixPdqv2, Version=1.0.0.0">
          <message name="QBP^Q23" isQuery="true"/>
          <message name="ADT^A01"/>
          <message name="ADT^A04"/>
          <message name="ADT^A05"/>
          <message name="ADT^A08"/>
        </handler>
        <handler type="MARC.HI.EHRS.CR.Messaging.PixPdqv2.PdqHandler, MARC.HI.EHRS.CR.Messaging.PixPdqv2, Version=1.0.0.0">
          <message name="QBP^Q22" isQuery="true"/>
        </handler>
        <handler type="MARC.HI.EHRS.CR.Messaging.PixPdqv2.NotSupportedHandler, MARC.HI.EHRS.CR.Messaging.PixPdqv2, Version=1.0.0.0">
          <message name="*"/>
        </handler>
      </service>-->
    <service name="LLP Listener" timeout="00:00:30" address="llp://0.0.0.0:2200">
      <handler type="MARC.HI.EHRS.CR.Messaging.PixPdqv2.PixHandler, MARC.HI.EHRS.CR.Messaging.PixPdqv2, Version=1.0.0.0">
        <message name="QBP^Q23" isQuery="true"/>
        <message name="ADT^A01"/>
        <message name="ADT^A04"/>
        <message name="ADT^A05"/>
        <message name="ADT^A08"/>
      </handler>
      <handler type="MARC.HI.EHRS.CR.Messaging.PixPdqv2.PdqHandler, MARC.HI.EHRS.CR.Messaging.PixPdqv2, Version=1.0.0.0">
        <message name="QBP^Q22" isQuery="true"/>
      </handler>
      <handler type="MARC.HI.EHRS.CR.Messaging.PixPdqv2.NotSupportedHandler, MARC.HI.EHRS.CR.Messaging.PixPdqv2, Version=1.0.0.0">
        <message name="*"/>
      </handler>
    </service>
  </services>
</marc.hi.ehrs.cr.messaging.hl7>
